input,task,time,date,task_detail
"Schedule a dinner with Paul for next Friday at 7 PM.","set_reminder","7:00 PM","next Friday","Dinner with Paul"
"Set a reminder to pay the water bill by 8 PM today.","set_reminder","8:00 PM","Today","Pay water bill"
"Remind me to mow the lawn on Tuesday morning.","set_reminder","morning","Tuesday","Mow the lawn"
"Schedule a client meeting for Monday at 10:30 AM.","set_reminder","10:30 AM","Monday","Client meeting"
"Remind me to buy train tickets on the 22nd of this month at 2 PM.","set_reminder","2:00 PM","22nd of this month","Buy train tickets"
"Set a reminder for the dance class on Wednesday at 6 PM.","set_reminder","6:00 PM","Wednesday","Dance class"
"Schedule a doctor appointment for next Thursday at 4:30 PM.","set_reminder","4:30 PM","next Thursday","Doctor appointment"
"Remind me to send the package on Friday evening at 5 PM.","set_reminder","5:00 PM","Friday","Send package"
"Remind me to call the plumber tomorrow afternoon.","set_reminder","afternoon","tomorrow","Call the plumber"
"Schedule a team training session for next Tuesday morning at 10 AM.","set_reminder","10:00 AM","next Tuesday","Team training session"
"Set a reminder to review the project timeline on Wednesday at 2 PM.","set_reminder","2:00 PM","Wednesday","Review project timeline"
"Remind me to pick up the kids from school next Thursday at 3:30 PM.","set_reminder","3:30 PM","next Thursday","Pick up kids from school"
"Schedule a doctor's appointment for next Friday at 11:15 AM.","set_reminder","11:15 AM","next Friday","Doctor's appointment"
"Set a reminder to submit the monthly report on the 1st of next month by 9 AM.","set_reminder","9:00 AM","1st of next month","Submit monthly report"
"Remind me to water the garden every morning at 8 AM.","set_reminder","8:00 AM","every morning","Water garden"
"Schedule a virtual team meeting for next Monday at 1:30 PM.","set_reminder","1:30 PM","next Monday","Virtual team meeting"
"Set a reminder to renew the library books on the 10th of this month.","set_reminder","","10th of this month","Renew library books"
"Remind me to call the IT support team next Tuesday at 11 AM.","set_reminder","11:00 AM","next Tuesday","Call IT support team"
"Schedule a dentist appointment for next Thursday morning at 9 AM.","set_reminder","9:00 AM","next Thursday","Dentist appointment"
"Set a reminder for the quarterly financial review on April 5th at 3 PM.","set_reminder","3:00 PM","April 5th","Quarterly financial review"
"Remind me to send the client proposal by the end of the day on Friday.","set_reminder","end of the day","Friday","Send client proposal"
"Schedule a team building activity for next Saturday afternoon.","set_reminder","afternoon","next Saturday","Team building activity"
"Set a reminder to pay the phone bill on the 15th of next month.","set_reminder","","15th of next month","Pay phone bill"
"Remind me to call the vet next Wednesday at 2:30 PM.","set_reminder","2:30 PM","next Wednesday","Call vet"
"Schedule a doctor's appointment for next Monday at 10:45 AM.","set_reminder","10:45 AM","next Monday","Doctor's appointment"
"Set a reminder for the monthly project review on the 1st of next month at 4 PM.","set_reminder","4:00 PM","1st of next month","Monthly project review"
"Remind me to water the plants every evening at 6 PM.","set_reminder","6:00 PM","every evening","Water plants"
"Schedule a lunch meeting with the marketing team for next Thursday at 12 PM.","set_reminder","12:00 PM","next Thursday","Lunch meeting with marketing team"
"Set a reminder to buy bread on the 3rd of this month at 10 AM.","set_reminder","10:00 AM","3rd of this month","Buy bread"
"Remind me to call the plumber on the 9th of this month at 12 PM.","set_reminder","12:00 PM","9th of this month","Call plumber"
"Schedule a lunch with Karen for next Monday at 1 PM.","set_reminder","1:00 PM","next Monday","Lunch with Karen"
"Set a reminder to pay the rent by 5 PM today.","set_reminder","5:00 PM","Today","Pay rent"
"Remind me to trim the plants on Wednesday morning.","set_reminder","morning","Wednesday","Trim the plants"
"Schedule a sales meeting for Tuesday at 11:30 AM.","set_reminder","11:30 AM","Tuesday","Sales meeting"
"Remind me to buy bus tickets on the 23rd of this month at 3 PM.","set_reminder","3:00 PM","23rd of this month","Buy bus tickets"
"Set a reminder for the cooking class on Thursday at 5 PM.","set_reminder","5:00 PM","Thursday","Cooking class"
"Schedule a hairdresser appointment for next Saturday at 3:30 PM.","set_reminder","3:30 PM","next Saturday","Hairdresser appointment"
"Remind me to send the documents on Monday evening at 6 PM.","set_reminder","6:00 PM","Monday","Send documents"
"Set a reminder to clean the kitchen on Sunday at 11 AM.","set_reminder","11:00 AM","Sunday","Clean the kitchen"
"Remind me to buy a gift for Peter on the 19th of this month at 4 PM.","set_reminder","4:00 PM","19th of this month","Buy gift for Peter"
"Schedule a breakfast with Lily for next Tuesday at 9 AM.","set_reminder","9:00 AM","next Tuesday","Breakfast with Lily"
"Set a reminder to pay the electricity bill by 7 PM today.","set_reminder","7:00 PM","Today","Pay electricity bill"
"Remind me to feed the birds on Thursday morning.","set_reminder","morning","Thursday","Feed the birds"
"Schedule a marketing meeting for Friday at 2:30 PM.","set_reminder","2:30 PM","Friday","Marketing meeting"
"Remind me to book a restaurant for the party on the 24th of this month at 1 PM.","set_reminder","1:00 PM","24th of this month","Book restaurant for party"
"Set a reminder for the painting class on Saturday at 10 AM.","set_reminder","10:00 AM","Saturday","Painting class"
"Schedule a doctor appointment for next Sunday at 4:30 PM.","set_reminder","4:30 PM","next Sunday","Doctor appointment"
"Remind me to send the invitation cards on Tuesday evening at 7 PM.","set_reminder","7:00 PM","Tuesday","Send invitation cards"
"Set a reminder to wash the dog on Monday at 2 PM.","set_reminder","2:00 PM","Monday","Wash the dog"
"Remind me to pick up the package on the 16th of this month at 5 PM.","set_reminder","5:00 PM","16th of this month","Pick up package"
"Schedule a dinner with George for next Wednesday at 8 PM.","set_reminder","8:00 PM","next Wednesday","Dinner with George"
"Set a reminder to pay the internet bill by 6 PM today.","set_reminder","6:00 PM","Today","Pay internet bill"
"Remind me to water the flowers on Friday morning.","set_reminder","morning","Friday","Water the flowers"
"Schedule a team meeting for Thursday at 3:30 PM.","set_reminder","3:30 PM","Thursday","Team meeting"
"Remind me to buy movie tickets on the 26th of this month at 12 PM.","set_reminder","12:00 PM","26th of this month","Buy movie tickets"
"Set a reminder for the guitar class on Sunday at 4 PM.","set_reminder","4:00 PM","Sunday","Guitar class"
"Schedule a dentist appointment for next Monday at 10:30 AM.","set_reminder","10:30 AM","next Monday","Dentist appointment"
"Remind me to post the parcel on Wednesday morning at 9 AM.","set_reminder","9:00 AM","Wednesday","Post parcel"
"Set a reminder to buy groceries on the 2nd of this month at 2 PM.","set_reminder","2:00 PM","2nd of this month","Buy groceries"
"Remind me to call the electrician on the 7th of this month at 10 AM.","set_reminder","10:00 AM","7th of this month","Call electrician"
"Schedule a lunch with Sarah for next Thursday at 12 PM.","set_reminder","12:00 PM","next Thursday","Lunch with Sarah"
"Set a reminder to pay the car insurance by 4 PM today.","set_reminder","4:00 PM","Today","Pay car insurance"
"Remind me to vacuum the house on Monday afternoon.","set_reminder","afternoon","Monday","Vacuum the house"
"Schedule a product meeting for Wednesday at 11:30 AM.","set_reminder","11:30 AM","Wednesday","Product meeting"
"Remind me to buy ferry tickets on the 21st of this month at 3 PM.","set_reminder","3:00 PM","21st of this month","Buy ferry tickets"
"Set a reminder for the photography class on Tuesday at 5 PM.","set_reminder","5:00 PM","Tuesday","Photography class"
"Schedule a mechanic appointment for next Saturday at 2:30 PM.","set_reminder","2:30 PM","next Saturday","Mechanic appointment"
"Remind me to send the report on Monday evening at 6 PM.","set_reminder","6:00 PM","Monday","Send report"
"Set a reminder to clean the bathroom on Sunday at 11 AM.","set_reminder","11:00 AM","Sunday","Clean the bathroom"
"Remind me to buy a gift for Mary on the 17th of this month at 4 PM.","set_reminder","4:00 PM","17th of this month","Buy gift for Mary"
"Schedule a breakfast with Tom for next Tuesday at 9 AM.","set_reminder","9:00 AM","next Tuesday","Breakfast with Tom"
"Set a reminder to pay the health insurance by 7 PM today.","set_reminder","7:00 PM","Today","Pay health insurance"
"Remind me to feed the fish on Thursday morning.","set_reminder","morning","Thursday","Feed the fish"
"Schedule a finance meeting for Friday at 2:30 PM.","set_reminder","2:30 PM","Friday","Finance meeting"
"Remind me to book a taxi for the airport on the 24th of this month at 1 PM.","set_reminder","1:00 PM","24th of this month","Book taxi for airport"
"Set a reminder for the singing class on Saturday at 10 AM.","set_reminder","10:00 AM","Saturday","Singing class"
"Schedule a physiotherapist appointment for next Sunday at 4:30 PM.","set_reminder","4:30 PM","next Sunday","Physiotherapist appointment"
"Remind me to send the invoices on Tuesday evening at 7 PM.","set_reminder","7:00 PM","Tuesday","Send invoices"
"Set a reminder to wash the windows on Monday at 2 PM.","set_reminder","2:00 PM","Monday","Wash the windows"
"Remind me to pick up the prescription on the 16th of this month at 5 PM.","set_reminder","5:00 PM","16th of this month","Pick up prescription"
"Schedule a dinner with Grace for next Wednesday at 8 PM.","set_reminder","8:00 PM","next Wednesday","Dinner with Grace"
"Set a reminder to pay the heating bill by 6 PM today.","set_reminder","6:00 PM","Today","Pay heating bill"
"Remind me to water the garden on Friday morning.","set_reminder","morning","Friday","Water the garden"
"Schedule a team meeting for Thursday at 3:30 PM.","set_reminder","3:30 PM","Thursday","Team meeting"
"Remind me to buy theatre tickets on the 26th of this month at 12 PM.","set_reminder","12:00 PM","26th of this month","Buy theatre tickets"
"Set a reminder for the piano class on Sunday at 4 PM.","set_reminder","4:00 PM","Sunday","Piano class"
"Schedule an optician appointment for next Monday at 10:30 AM.","set_reminder","10:30 AM","next Monday","Optician appointment"
"Remind me to post the birthday card on Wednesday morning at 9 AM.","set_reminder","9:00 AM","Wednesday","Post birthday card"